{
  "format": "scene-render-capabilities/1",
  "engine": {
    "name": "rs-scene-render",
    "version": "0.2.1"
  },
  "schema": "1.5.0",
  "entries": [
    {
      "construct": "adjustment/@motionBlur=on",
      "status": "reported",
      "note": "an adjustment layer that moves is not motion blurred: it adjusts where it is at the frame time"
    },
    {
      "construct": "material/@unevenness",
      "status": "approximate",
      "when": [
        "camera/@renderer=pathtrace"
      ],
      "note": "surface unevenness is applied by the raster renderer only"
    },
    {
      "construct": "object3D/@shadowCatcher=true",
      "status": "reported",
      "when": [
        "camera/@renderer=pathtrace"
      ],
      "note": "shadow catchers are applied by the raster renderer only"
    },
    {
      "construct": "pattern",
      "status": "approximate",
      "note": "drawn as the project background and on shapes; on vector and text assets, captions and map drapes it is not drawn, and reported"
    },
    {
      "construct": "scene360/@layout=eac",
      "status": "approximate",
      "note": "the frames are drawn; no spherical metadata is written, as it needs a mesh projection"
    },
    {
      "construct": "scene360/@layout=fisheye-180",
      "status": "approximate",
      "note": "the frames are drawn; no spherical metadata is written, as it needs a mesh projection"
    },
    {
      "construct": "compute",
      "status": "reported",
      "note": "SREP 67 is accepted and not implemented by this engine yet: the element is reported (E22) and draws nothing"
    }
  ]
}
